Species;Species2;References;Webpage;;;;;;;;;;;;;;;
Abuta grandifolia;Abuta grandifolia;Charlotte Sayagh, Christophe Long, Christian Moretti, Catherine Lavaud,Saponins and alkaloids from Abuta grandifolia, Phytochemistry Letters, Volume 5, Issue 1,2012,Pages 188-193,ISSN 1874-3900,https://doi.org/10.1016/j.phytol.2011.12.007. https://www.sciencedirect.com/science/article/pii/S1874390011001856);https://doi.org/10.1016/j.phytol.2011.12.007;.;;;;;;;;;;;;;;
Abuta grandifolia;Abuta grandifolia;Ciccia, G., Coussio, J., & Mongelli, E. (2000). Insecticidal activity against Aedes aegypti larvae of some medicinal South American plants. Journal of ethnopharmacology, 72(1-2), 185–189. https://doi.org/10.1016/s0378-8741(00)00241-5;https://doi.org/10.1016/s0378-8741(00)00241-5;.;;;;;;;;;;;;;;
Abuta grandifolia;Abuta grandifolia;Desmarchelier, C., Gurni, A., Ciccia, G., & Giulietti, A. M. (1996). Ritual and medicinal plants of the Ese’ejas of the Amazonian rainforest (Madre de Dios, Perú). Journal of Ethnopharmacology, 52(1), 45–51. https://doi.org/10.1016/0378-8741(96)01390-6;https://doi.org/10.1016/0378-8741(96)01390-6;.;;;;;;;;;;;;;;
Abuta grandifolia;Abuta grandifolia;Garavito, G., Rincón, J., Arteaga, L., Hata, Y., Bourdy, G., Gimenez, A., Pinzón, R., & Deharo, E. (2006). Antimalarial activity of some Colombian medicinal plants. Journal of Ethnopharmacology, 107(3), 460–462. https://doi.org/10.1016/j.jep.2006.03.033;https://doi.org/10.1016/j.jep.2006.03.033;.;;;;;;;;;;;;;;
Abuta grandifolia;Abuta grandifolia;Kloucek, P., Svobodova, B., Polesny, Z., Langrova, I., Smrcek, S., & Kokoska, L. (2007). Antimicrobial activity of some medicinal barks used in Peruvian Amazon. Journal of ethnopharmacology, 111(2), 427–429. https://doi.org/10.1016/j.jep.2006.11.010;https://doi.org/10.1016/j.jep.2006.11.010;.;;;;;;;;;;;;;;
Abuta grandifolia;Abuta grandifolia;Lizcano, L. J., Bakkali, F., Begoña Ruiz-Larrea, M., & Ignacio Ruiz-Sanz, J. (2010). Antioxidant activity and polyphenol content of aqueous extracts from Colombian Amazonian plants with medicinal use. Food Chemistry, 119(4), 1566–1570. https://doi.org/10.1016/j.foodchem.2009.09.043;https://doi.org/10.1016/j.foodchem.2009.09.043;.;;;;;;;;;;;;;;
Abuta grandifolia;Abuta grandifolia;"Mongelli E, Desmarchelier C, Coussio J, Ciccia G. [Antimicrobial activity and interaction with DNA of medicinal plants from the Peruvian Amazon region]. Revista Argentina de Microbiologia. 1995 Oct-Dec;27(4):199-203. PMID: 8850132.";https://europepmc.org/article/med/8850132;.;;;;;;;;;;;;;;
Abuta grandifolia;Abuta grandifolia;Santos, R. S., Coelho-Ferreira, M., Lima, P. G. C., & Magalhães, M. P.. (2019). Useful plants and their relation to archaeological sites in the Serra de Carajás, Brazil. Anais Da Academia Brasileira De Ciências, 91(1), e20170909. https://doi.org/10.1590/0001-3765201920170909;https://doi.org/10.1590/0001-3765201920170909;Supp. Mat;;;;;;;;;;;;;;
Abuta grandifolia;Abuta grandifolia;Steele, J. C., Simmonds, M. S., Veitch, N. C., & Warhurst, D. C. (1999). Evaluation of the anti-plasmodial activity of bisbenzylisoquinoline alkaloids from Abuta grandifolia. Planta medica, 65(5), 413–416. https://doi.org/10.1016/0378-8741(96)01390-6;https://doi.org/10.1055/s-1999-14017;.;;;;;;;;;;;;;;
Ambelania acida;Ambelania acida;Corrêa, P. G., Moura, L. G. S., Amaral, A. C. F., Almeida, M. M. H. de, Souza, F. das C. do A., Aguiar, J. P. L., Aleluia, R. L., & Silva, J. R. de A. (2023). Evaluation of the Amazonian fruit Ambelania acida: Chemical and nutritional studies. Journal of Food Science, 88(2), 757–771. https://doi.org/10.1111/1750-3841.16455;https://doi.org/10.1111/1750-3841.16455;.;;;;;;;;;;;;;;
Ampelocera edentula;Ampelocera edentula;Fournet, A., Barrios, A. A., Muñoz, V., Hocquemiller, R., Roblot, F., & Cavé, A. (1994). Antileishmanial activity of a tetralone isolated from Ampelocera edentula, a Bolivian plant used as a treatment for cutaneous leishmaniasis. Planta medica, 60(1), 8–12. https://doi.org/10.1055/s-2006-959397;https://doi.org/10.1055/s-2006-959397;.;;;;;;;;;;;;;;
Amphirrhox longifolia;Amphirrhox longifolia;Yanomami, M. I., Yanomami, E., Albert, B., Milliken, W., & Coelho, V. (2015). Hwërɨmamotima thë pë ã oni: Manual dos remédios tradicionais Yanomami. Boa Vista, Roraima, Brasil: Hutukara Associação Yanomami. ISBN: 978-8582260258.;https://acervo.socioambiental.org/index.php/acervo/publicacoes-isa/manual-dos-remedios-tradicionais-yanomami;https://dataspace.princeton.edu/handle/88435/dsp018s45qc64v?mode=full;.;;;;;;;;;;;;;
Anacardium spruceanum;Anacardium spruceanum;Lorenzi, H. Árvores Brasileiras. Ed. Plantarum, 2009. 364 p. Vol. III;https://www.academia.edu/32943874/Arvores_Brasileiras_Lorenzi_volume_3;.;;;;;;;;;;;;;;
Andira micrantha;Andira micrantha;Dario, F. R. (2024). Dynamics of knowledge and the biocultural heritage of indigenous people in the Amazon. World News of Natural Sciences, 54, 102–122. Available: http://www.worldnewsnaturalsciences.com/wp-content/uploads/2024/03/WNOFNS-54-2024-102-122.pdf.;http://www.worldnewsnaturalsciences.com/wp-content/uploads/2024/03/WNOFNS-54-2024-102-122.pdf;.;;;;;;;;;;;;;;
Andira micrantha;Andira micrantha;"Demarchi, L. O. (2014). Composição, conhecimento e uso de plantas de campinarana por moradores da Reserva de Desenvolvimento Sustentável do Tupé – Amazônia Central (Dissertação de Mestrado, Instituto Nacional de Pesquisas da Amazônia - INPA, Programa de Ecologia). Orientadora: Piedade, M. T. F.; Coorientadora: Scudeller, V. V. Instituto Nacional de Pesquisas da Amazônia - INPA.";https://repositorio.inpa.gov.br/handle/1/11923;.;;;;;;;;;;;;;;
Andira parviflora;Andira parviflora;Costa, G., Sampaio, P. de T. B., Ribeiro, R. A. de S., Soares, J. J., & Mendonça, R. M. (2022). Formulação de massa cerâmica para revestimento poroso utilizando resíduos de madeiras tropicais. Ciência Florestal, 32(4), 2348–2371. https://doi.org/10.5902/1980509870383;https://doi.org/10.5902/1980509870383;.;;;;;;;;;;;;;;
Andira parviflora;Andira parviflora;Garcia, M.G., Nascimento, C.C., Ferreira, A.G. et al. Identification of Isoflavonoids in Wood Residue from Swartzia laevicarpa, Dipteryx odorata, and Andira parviflora. Chem Nat Compd 54, 856–859 (2018). https://doi.org/10.1007/s10600-018-2498-5;https://doi.org/10.1007/s10600-018-2498-5;.;;;;;;;;;;;;;;
Aniba canelilla;Aniba canelilla;de Lima, A. B., Santana, M. B., Cardoso, A. S., da Silva, J. K., Maia, J. G., Carvalho, J. C., & Sousa, P. J. (2009). Antinociceptive activity of 1-nitro-2-phenylethane, the main component of Aniba canelilla essential oil. Phytomedicine : international journal of phytotherapy and phytopharmacology, 16(6-7), 555–559. https://doi.org/10.1016/j.phymed.2008.10.007;https://doi.org/10.1016/j.phymed.2008.10.007;.;;;;;;;;;;;;;;
Aniba canelilla;Aniba canelilla;Kreutz, Tainá. Óleo essencial de casca-preciosa (Aniba canelilla (H. B. K. ) Mez) : validação de metodologia bioanalítica e estudo de permeação cutânea in vitro. 2017. 122 f. Dissertação (Mestrado) - Curso de Faculdade de Farmácia, Programa de Pós-Graduação em Ciências Farmacêuticas, Universidade Federal do Rio Grande do Sul, Porto Alegre, 2017. Available in: https://lume.ufrgs.br/handle/10183/164429?locale-attribute=pt_BR. Acessed: 24 Mar 2025.;https://lume.ufrgs.br/handle/10183/164429?locale-attribute=pt_BR;.;;;;;;;;;;;;;;
Annona ambotay;Annona ambotay;Takahashi, J. A., Pereira, C. R., Pimenta, L. P. S., Boaventura, M. A. D., & Silva, L. G. F. E. (2006). Antibacterial activity of eight Brazilian annonaceae plants. Natural Product Research, 20(1), 21–26. https://doi.org/10.1080/14786410412331280087;https://doi.org/10.1080/14786410412331280087;.;;;;;;;;;;;;;;
Annona ambotay;Annona ambotay;Yanomami, M. I., Yanomami, E., Albert, B., Milliken, W., & Coelho, V. (2015). Hwërɨmamotima thë pë ã oni: Manual dos remédios tradicionais Yanomami. Boa Vista, Roraima, Brasil: Hutukara Associação Yanomami. ISBN: 978-8582260258.;https://acervo.socioambiental.org/index.php/acervo/publicacoes-isa/manual-dos-remedios-tradicionais-yanomami;.;;;;;;;;;;;;;;
Aspidosperma desmanthum;Aspidosperma desmanthum;Henrique, M. C., Nunomura, S. M., & Pohlit, A. M.. (2010). Alcaloides indólicos de cascas de Aspidosperma vargasii e A. desmanthum. Química Nova, 33(2), 284–287. https://doi.org/10.1590/S0100-40422010000200010;https://doi.org/10.1590/S0100-40422010000200010;.;;;;;;;;;;;;;;
Aspidosperma excelsum;Aspidosperma excelsum;Milliken, W. (1997). Traditional anti-malarial medicine in Roraima, Brazil. Econ Bot 51, 212–237. https://doi.org/10.1007/BF02862091;https://doi.org/10.1007/BF02862091;.;;;;;;;;;;;;;;
Aspidosperma excelsum;Aspidosperma excelsum;Oliveira, F. Q., Junqueira, R. G., Stehmann, J. R., & Brandão, M. G. L. (2003). Potencial das plantas medicinais como fonte de novos antimaláricos: Espécies indicadas na bibliografia etnomédica brasileira. Revista Brasileira de Plantas Medicinais, 5(1), 23;https://www1.ibb.unesp.br/Home/Departamentos/Botanica/RBPM-RevistaBrasileiradePlantasMedicinais/artigo4_v5_n2.pdf;https://www.sbpmed.org.br/admin/files/papers/file_0L5RuTOlHFr0.pdf;.;;;;;;;;;;;;;
Aspidosperma excelsum;Aspidosperma excelsum;Trindade, R. C. dos S., Kikuchi, T. Y. S., Silva, R. J. F., Vale, V. V., Oliveira, A. B. de, Dolabela, M. F., & Coelho-Ferreira, M. R. (2017). Estudo farmacobotânico das folhas de Aspidosperma excelsum Benth. (Apocináceas). Revista Fitos, 10(3), 238-253. https://doi.org/10.5935/2446-4775.20160019;https://rc.cplp.org/Record/oasisbr_lr_9721f5eadf4a29ae4d0d10fc6814986f;.;;;;;;;;;;;;;;
Aspidosperma rigidum;Aspidosperma rigidum;Oliveira, D. R., Krettli, A. U., Aguiar, A. C., Leitão, G. G., Vieira, M. N., Martins, K. S., & Leitão, S. G. (2015). Ethnopharmacological evaluation of medicinal plants used against malaria by quilombola communities from Oriximiná, Brazil. Journal of ethnopharmacology, 173, 424–434. https://doi.org/10.1016/j.jep.2015.07.035;https://doi.org/10.1016/j.jep.2015.07.035;.;;;;;;;;;;;;;;
Astronium lecointei;Astronium lecointei;Mota, G.S., Araujo, E.S., Lorenço, M. et al. Bark of Astronium lecointei Ducke trees from the Amazon: chemical and structural characterization. Eur. J. Wood Prod. 79, 1087–1096 (2021). https://doi.org/10.1007/s00107-021-01670-w;https://doi.org/10.1007/s00107-021-01670-w;.;;;;;;;;;;;;;;
Botryarrhena pendula;Botryarrhena pendula;Cárdenas López, D., Marín Canchala, N. L., & Castaño Arboleda, N. (2012). Plantas alimenticias no convencionales en Amazonia colombiana y anotaciones sobre otras plantas alimenticias. Revista Colombia Amazónica, 5;https://sinchi.org.co/files/publicaciones/revista/pdf/5/4%20plantas%20alimenticias%20no%20convencionales%20en%20amazonia%20colombiana%20y%20anotaciones%20sobre%20otras%20plantas%20alimenticias.pdf;.;;;;;;;;;;;;;;
Brosimum guianense;Brosimum guianense;Cárdenas López, D., Marín Canchala, N. L., & Castaño Arboleda, N. (2012). Plantas alimenticias no convencionales en Amazonia colombiana y anotaciones sobre otras plantas alimenticias. Revista Colombia Amazónica, 5;https://sinchi.org.co/files/publicaciones/revista/pdf/5/4%20plantas%20alimenticias%20no%20convencionales%20en%20amazonia%20colombiana%20y%20anotaciones%20sobre%20otras%20plantas%20alimenticias.pdf;.;;;;;;;;;;;;;;
Buchenavia grandis;Buchenavia grandis;Van Andel, T. (2000). Non-timber forest products of the North-West District of Guyana. Part II: A field guide (Vol. 2). Tropenbos International. ISBN: 90-393-2536-7. Disponível em (https://www.tropenbos.org/resources/publications/non-timber+forest+products+of+the+north-west+district+of+guyana+part+ii+a+field+guide);https://www.tropenbos.org/resources/publications/non-timber+forest+products+of+the+north-west+district+of+guyana+part+ii+a+field+guide;.;;;;;;;;;;;;;;
Caryocar pallidum;Caryocar pallidum;Cárdenas López, D., Marín Canchala, N. L., & Castaño Arboleda, N. (2012). Plantas alimenticias no convencionales en Amazonia colombiana y anotaciones sobre otras plantas alimenticias. Revista Colombia Amazónica, 5;https://sinchi.org.co/files/publicaciones/revista/pdf/5/4%20plantas%20alimenticias%20no%20convencionales%20en%20amazonia%20colombiana%20y%20anotaciones%20sobre%20otras%20plantas%20alimenticias.pdf;.;;;;;;;;;;;;;;
Casearia javitensis;Casearia javitensis;Espinar, M. T. F. (2015). Estudo químico e biológico de Casearia javitensis Kunth (Dissertação de mestrado, Universidade do Estado do Amazonas). Universidade do Estado do Amazonas. Páginas 2–57.;https://ppbio.inpa.gov.br/sites/default/files/Espinar_M_T_F_Dissertacao_2015.pdf;.;;;;;;;;;;;;;;
Casearia javitensis;Casearia javitensis;Yanomami, M. I., Yanomami, E., Albert, B., Milliken, W., & Coelho, V. (2015). Hwërɨmamotima thë pë ã oni [Manual dos remédios tradicionais Yanomami]. Boa Vista, Roraima, Brasil: Hutukara Associação Yanomami. ISBN: 978-8582260258.;https://acervo.socioambiental.org/index.php/acervo/publicacoes-isa/manual-dos-remedios-tradicionais-yanomami;.;;;;;;;;;;;;;;
Casearia sylvestris;Casearia sylvestris;Ameni, A. Z., Latorre, O. A., Torres, L. M., & Górniak, S. L. (2015). Toxicity study about a medicinal plant Casearia sylvestris: A contribution to the Brazilian Unified Health System (SUS). Journal of ethnopharmacology, 175, 9–13. https://doi.org/10.1016/j.jep.2015.08.027;https://doi.org/10.1016/j.jep.2015.08.027;.;;;;;;;;;;;;;;
Casearia sylvestris;Casearia sylvestris;Brandão, M. G. L., Pignal, M., Romaniuc, S., Grael, C. F. F., & Fagg, C. W. (2012). Useful Brazilian plants listed in the field books of the French naturalist Auguste de Saint-Hilaire (1779–1853). Journal of Ethnopharmacology, 143(2), 488–500. https://doi.org/10.1016/j.jep.2012.06.052;https://doi.org/10.1016/j.jep.2012.06.052;.;;;;;;;;;;;;;;
Casearia sylvestris;Casearia sylvestris;Ferreira, P. M. P., Costa-Lotufo, L. V., Moraes, M. O., Barros, F. W. A., Martins, A. M. A., Cavalheiro, A. J., Bolzani, V. S., Santos, A. G., & Pessoa, C.. (2011). Folk uses and pharmacological properties of Casearia sylvestris: a medicinal review. Anais da Academia Brasileira De Ciências, 83(4), 1373–1384. https://doi.org/10.1590/S0001-37652011005000040;https://doi.org/10.1590/S0001-37652011005000040;.;;;;;;;;;;;;;;
Casearia sylvestris;Casearia sylvestris;Hoehne, F. (1939). Plantas e substâncias vegetais tóxicas e medicinais. São Paulo: Departamento de Botânica do Estado.;https://archive.org/details/PlantasESubstanciasVegetaisToxicasEMedicinais/mode/1up?q=sylvestris&view=theater;.;;;;;;;;;;;;;;
Casearia sylvestris;Casearia sylvestris;Silva, R. A. da. (2016). Casearia sylvestris Sw.: Uma planta brasileira de interesse do SUS (Trabalho de conclusão de curso, Fundação Oswaldo Cruz/Farmanguinhos/NGBS/CTM). Fundação Oswaldo Cruz.;https://www.arca.fiocruz.br/handle/icict/18486;.;;;;;;;;;;;;;;
Casearia sylvestris;Casearia sylvestris;Teixeira, N., Melo, J. C. S., Batista, L. F., Paula-Souza, J., Fronza, P., & Brandão, M. G. L. (2019). Edible fruits from Brazilian biodiversity: A review on their sensorial characteristics versus bioactivity as tool to select research. Food research international (Ottawa, Ont.), 119, 325–348. https://doi.org/10.1016/j.foodres.2019.01.058;https://doi.org/10.1016/j.foodres.2019.01.058;.;;;;;;;;;;;;;;
Cedrelinga cateniformis;Cedrelinga cateniformis;Haag, V., Koch, G., Melcher, E., & Welling, J. (2020). Characterization of the wood properties of Cedrelinga cateniformis as substitute for timbers used for window manufacturing and outdoor applications. Maderas. Ciencia y tecnología, 22(1), 23–36. https://doi.org/10.4067/S0718-221X2020005000103;https://doi.org/10.4067/S0718-221X2020005000103;.;;;;;;;;;;;;;;
Cedrelinga cateniformis;Cedrelinga cateniformis;Yanomami, M. I., Yanomami, E., Albert, B., Milliken, W., & Coelho, V. (2015). Hwërɨmamotima thë pë ã oni: Manual dos remédios tradicionais Yanomami. Boa Vista, Roraima, Brasil: Hutukara Associação Yanomami. ISBN: 978-8582260258.;https://acervo.socioambiental.org/index.php/acervo/publicacoes-isa/manual-dos-remedios-tradicionais-yanomami;.;;;;;;;;;;;;;;
Cheiloclinium cognatum;Cheiloclinium cognatum;Costa, E. A., Santos, L. R., Pontes, I. S., Matos, L. G., Silva, G. A., & Lião, L. M.. (2007). Analgesic and anti-inflammatory effects of Cheiloclinium cognatum root barks. Revista Brasileira De Farmacognosia, 17(4), 508–513. https://doi.org/10.1590/S0102-695X2007000400006;https://doi.org/10.1590/S0102-695X2007000400006;.;;;;;;;;;;;;;;
Chrysophyllum argenteum;Chrysophyllum argenteum;Hammer, K. Chrysophyllum argenteum subsp. auratum (Miq.) Pennington. 2001. Disponível em: http://mansfeld.ipk-gatersleben.de/apex/f?p=185:46:8960159578453::NO::module,source,taxid,akzname:mf,botnam,6773,Chrysophyllum%20argenteum%20subsp.%20auratum;https://mansfeld.ipk-gatersleben.de/apex/f?p=185:46:8960159578453::NO::module,source,taxid,akzname:mf,botnam,6773,Chrysophyllum%20argenteum%20subsp.%20auratum;.;;;;;;;;;;;;;;
Chrysophyllum manaosense;Chrysophyllum manaosense;Trujillo-C., W., & Correa-Múnera, M. (2010). Plantas usadas por una comunidad indígena Coreguaje en la Amazonía colombiana. *Caldasia, 32*(1), 1–20. Acessed 25 March 2025, from http://www.scielo.org.co/scielo.php?script=sci_arttext&pid=S0366-52322010000100001&lng=en&tlng=;http://www.scielo.org.co/scielo.php?script=sci_arttext&pid=S0366-52322010000100001&lng=en&tlng=;.;;;;;;;;;;;;;;
Chrysophyllum sparsiflorum;Chrysophyllum sparsiflorum;Santos, R. S., Coelho-Ferreira, M., Lima, P. G. C., & Magalhães, M. P.. (2019). Useful plants and their relation to archaeological sites in the Serra de Carajás, Brazil. Anais Da Academia Brasileira De Ciências, 91(1), e20170909. https://doi.org/10.1590/0001-3765201920170909;https://doi.org/10.1590/0001-3765201920170909;Supp. Mat;;;;;;;;;;;;;;
Conceveiba guianensis;Conceveiba guianensis;Alvino, F. de O., Silva, M. F. F. da ., & Rayol, B. P.. (2005). Potencial de uso das espécies arbóreas de uma floresta secundária, na Zona Bragantina, Pará, Brasil. Acta Amazonica, 35(4), 413–420. https://doi.org/10.1590/S0044-59672005000400005.;https://doi.org/10.1590/S0044-59672005000400005;.;;;;;;;;;;;;;;
Conceveiba guianensis;Conceveiba guianensis;Braca, A., De Leo, M., Mendez, J., & Morelli, I. (2004). Constituents of Conceveiba guianensis (Euphorbiaceae). Biochemical Systematics and Ecology, 32(2), 225–228. https://doi.org/10.1016/s0305-1978(03)00137-6;http://dx.doi.org/10.1016/s0305-1978(03)00137-6;.;;;;;;;;;;;;;;
Conceveiba guianensis;Conceveiba guianensis;de Sousa Trindade, Maria José, & Alves Lameira, Osmar. (2014). Espécies úteis da família Euphorbiaceae no Brasil. Revista Cubana de Plantas Medicinales, 19(4), 292-309. Available in 25 March 2025, from http://scielo.sld.cu/scielo.php?script=sci_arttext&pid=S1028-47962014000400002&lng=es&tlng=pt.;http://scielo.sld.cu/scielo.php?script=sci_arttext&pid=S1028-47962014000400002&lng=es&tlng=pt;.;;;;;;;;;;;;;;
Conceveiba guianensis;Conceveiba guianensis;Souza, C. H., Progene, M. P. S. S., Guilhon, G. M. S. P., Müller, A. H., Arruda, A. C., Arruda, M. S. P., Santos, L. S., & Secco, R. S. (2004). Terpenoids from Conceveiba guianensis Aublet. *Biochemical Systematics and Ecology, 32*(10), 931–935. https://doi.org/10.1016/j.bse.2004.03.008;https://doi.org/10.1016/j.bse.2004.03.008;.;;;;;;;;;;;;;;
Connarus perrottetii;Connarus perrottetii;Coelho-Ferreira, M. (2009). Medicinal knowledge and plant utilization in an Amazonian coastal community of Marudá, Pará State (Brazil). Journal of Ethnopharmacology, 126(1), 159–175. https://doi.org/10.1016/j.jep.2009.07.016.;https://doi.org/10.1016/j.jep.2009.07.016;.;;;;;;;;;;;;;;
Connarus perrottetii;Connarus perrottetii;Müller, L. S., da Silveira, G. D., Dal Prá, V., Lameira, O., Viana, C., & Machado de Carvalho, L. (2016). Investigation of phenolic antioxidants as chemical markers in extracts of Connarus perrottetii var. Angustifolius Radlk by capillary zone electrophoresis. Journal of Liquid Chromatography & Related Technologies, 39(1), 13–20. https://doi.org/10.1080/10826076.2015.1115768;https://doi.org/10.1080/10826076.2015.1115768;.;;;;;;;;;;;;;;
Connarus perrottetii;Connarus perrottetii;Suffredini, I. B., Paciencia, M. L. B., Varella, A. D., & Younes, R. N. (2007). In vitro cytotoxic activity of Brazilian plant extracts against human lung, colon and CNS solid cancers and leukemia. Fitoterapia, 78(3), 223–226. https://doi.org/10.1016/j.fitote.2006.11.011;https://doi.org/10.1016/j.fitote.2006.11.011;.;;;;;;;;;;;;;;
Cordia exaltata;Cordia exaltata;Alarcón, J. G. S. (2005). Levantamento florístico e etnobotânico em um hectare de floresta de terra firme na região do Médio Rio Negro, Roraima, Brasil (Dissertação de Mestrado, Instituto de Pesquisas Jardim Botânico do Rio de Janeiro, Escola Nacional de Botânica Tropical). Rio de Janeiro, Brasil.;Request to the author;.;;;;;;;;;;;;;;
Cordia nodosa;Cordia nodosa;Costa, M. A. da S. (2004). Estudo comparativo dos morfotipos de Cordia nodosa Lam. (Boraginaceae) na Reserva Florestal Adolpho Ducke, Manaus-AM, baseado em análise morfológica, ecológica e molecular (Dissertação de Mestrado, Instituto Nacional de Pesquisas da Amazônia e Universidade Federal do Amazonas). Manaus, AM: Programa de Pós-Graduação em Biologia Tropical e Recursos Naturais.;https://repositorio.inpa.gov.br/handle/1/12792;.;;;;;;;;;;;;;;
Cordia panicularis;Cordia panicularis;Alarcón, J. G. S. (2005). Levantamento florístico e etnobotânico em um hectare de floresta de terra firme na região do Médio Rio Negro, Roraima, Brasil (Dissertação de Mestrado, Instituto de Pesquisas Jardim Botânico do Rio de Janeiro, Escola Nacional de Botânica Tropical). Rio de Janeiro, Brasil.;Request to the author;.;;;;;;;;;;;;;;
Alibertia/Cordiera myrciifolia;Alibertia/Cordiera myrciifolia;Anderson, A. B., & Posey, D. A. (1989). Management of a tropical scrub savanna by the Gorotire Kayapó of Brazil. In Posey, D. A., & Balée, W. (Eds.), Resource management in Amazonia: indigenous and folk strategies (Advances in Economic Botany, Vol. 7, pp. 159–173). New York: New York Botanical Garden.;https://repositorio.museu-goeldi.br/handle/mgoeldi/575;https://www.jstor.org/stable/43927550;.;;;;;;;;;;;;;
Alibertia/Cordiera myrciifolia;Alibertia/Cordiera myrciifolia;Luciano, J. H. S. (2009). Contribuição ao conhecimento químico de plantas do Nordeste: Alibertia myrciifolia Spruce ex K. Schum. e Alibertia rigida K. Schum. (Tese de Doutorado, Universidade Federal do Ceará). Universidade Federal do Ceará, Fortaleza.;http://repositorio.ufc.br/handle/riufc/15848;.;;;;;;;;;;;;;;
Couepia ulei;Couepia ulei;Cárdenas López, D., Marín Canchala, N. L., & Castaño Arboleda, N. (2012). Plantas alimenticias no convencionales en Amazonia colombiana y anotaciones sobre otras plantas alimenticias. Revista Colombia Amazónica, 5;"https://sinchi.org.co/files/publicaciones/revista/pdf/5/4%20plantas%20alimenticias%20no%20convencionales%20en%20amazonia%20colombiana%20y%20anotaciones%20sobre%20otras%20plantas%20alimenticias.pdf	.
";.;Corrigido;;;;;;;;;;;;;
Couepia ulei;Couepia ulei;Williams, L. (1936). Woods of northeastern Peru. Field Museum of Natural History, Chicago. Disponível em: https://www.biodiversitylibrary.org/item/19730#page/8/mode/2up. Acesso em: 12 de março de 2025.;https://www.biodiversitylibrary.org/item/19730#page/8/mode/2up;.;;;;;;;;;;;;;;
Couma macrocarpa;Couma macrocarpa;Cárdenas López D, Arias García J C, Vanegas Liévano J A, Jiménez Montoya D A, Vargas Romero O, Gómez Rodríguez L (2020): Lista de plantas útiles y promisorias en la Comunidad de Wacurabá (Caño Cuduyarí) en el Departamento de Vaupés (Amazonía Colombiana). v1.0. Instituto Amazónico de Investigaciones Científicas - SINCHI. Dataset/Checklist. https://doi.org/10.15472/rdsyao;https://sinchi.org.co/plantas-utiles-y-promisorias-en-la-comunidad-de-wacuraba-cano-cuduyari-en-el-departamento-de-vaupes-amazonia-colombiana;.;;;;;;;;;;;;;;
Couma macrocarpa;Couma macrocarpa;Couma macrocarpa Barb.Rodr. in GBIF Secretariat (2019). GBIF Backbone Taxonomy. Checklist dataset https://doi.org/10.15468/39omei accessed via GBIF.org on 2021-02-03.;;.;;;;;;;;;;;;;;
Couratari guianensis;Couratari guianensis;"Amorozo, M.C.M.; Gély, A.Uso de plantas medicinais por caboclos do Baixo Amazonas, Barcarena, PA, Brasil. Boletim do Museu Paraense Emílio Goeldi, Série Botânica, v.4, n.1, p.47-131, 1988.";https://repositorio.museu-goeldi.br/handle/mgoeldi/310;.;;;;;;;;;;;;;;
Couratari guianensis;Couratari guianensis;Cárdenas López D, Arias García J C, Vanegas Liévano J A, Jiménez Montoya D A, Vargas Romero O, Gómez Rodríguez L (2020): Lista de plantas útiles y promisorias en la Comunidad de Wacurabá (Caño Cuduyarí) en el Departamento de Vaupés (Amazonía Colombiana). v1.0. Instituto Amazónico de Investigaciones Científicas - SINCHI. Dataset/Checklist. https://doi.org/10.15472/rdsyao;https://sinchi.org.co/plantas-utiles-y-promisorias-en-la-comunidad-de-wacuraba-cano-cuduyari-en-el-departamento-de-vaupes-amazonia-colombiana;.;;;;;;;;;;;;;;
Couratari guianensis;Couratari guianensis;Garcia, F. M., Manfio, D. R., Sansígolo, C. A., & Magalhães, P. A. D.. (2012). Rendimento no desdobro de toras de Itaúba (Mezilaurus itauba) e Tauari (Couratari guianensis) segundo a classificação da qualidade da tora. Floresta E Ambiente, 19(4), 468–474. https://doi.org/10.4322/floram.2012.059;https://doi.org/10.4322/floram.2012.059;.;;;;;;;;;;;;;;
